{
  "schema_version": 1,
  "evaluation_id": "homer-qwen7b-20260906",
  "track": "homer_comparable",
  "protocol": "homer_unbiased_pass_at_k",
  "dataset": "homer_pretrained_7b_v2",
  "code_commit": "REPLACE_WITH_GIT_COMMIT",
  "source_generations_sha256": "0000000000000000000000000000000000000000000000000000000000000000",
  "dataset_manifest_sha256": "4444444444444444444444444444444444444444444444444444444444444444",
  "models": [
    {
      "role": "planner",
      "model_id": "Qwen/Qwen2.5-VL-7B-Instruct",
      "revision_or_snapshot": "cc594898137f460bfe9f0759e9844b3ce807cfb5",
      "adapter": null,
      "prompt_sha256": "1111111111111111111111111111111111111111111111111111111111111111",
      "checkpoint_manifest_sha256": "2222222222222222222222222222222222222222222222222222222222222222"
    },
    {
      "role": "generator",
      "model_id": "Qwen/Qwen2.5-VL-7B-Instruct",
      "revision_or_snapshot": "cc594898137f460bfe9f0759e9844b3ce807cfb5",
      "adapter": null,
      "prompt_sha256": "1111111111111111111111111111111111111111111111111111111111111111",
      "checkpoint_manifest_sha256": "2222222222222222222222222222222222222222222222222222222222222222"
    }
  ],
  "generation": {
    "temperature": 1.0,
    "candidates_per_image": 5,
    "seeds": [20260906, 20260907, 20260908],
    "repeated_trials": 5
  },
  "evaluator": {
    "model_id": "gpt-5-chat-latest",
    "canonical_model_id": "gpt-5-chat-latest",
    "version_or_date": "2026-09-06",
    "temperature": 0,
    "prompt_sha256": "3333333333333333333333333333333333333333333333333333333333333333",
    "substitution": false
  },
  "protocol_details": {
    "pass_at_k": [1, 3, 5],
    "homer_reference_groups": ["#top10", "#200-209", "#1000-1009", "Electronic Sheep High-Humor", "Electronic Sheep Low-Humor"],
    "notes": "Replace all placeholder hashes before use."
  }
}
